doi	paper_type	citation	is_methods_paper	explanation
doi:10.5281/zenodo.7260779	ScientificPrimaryResearchArticle	Alejandro Buschiazzo et al. (2022) Latin America and Caribbean Structural Biology Landscape Analysis Report	False	The paper is likely focused on analyzing the current state of structural biology in Latin America and the Caribbean, which suggests a goal of understanding the existing landscape rather than developing new techniques or methods.
doi:10.1016/j.cels.2022.10.001	ScientificPrimaryResearchArticle	Way GP, Natoli T, Adeboye A, Litichevskiy L, Yang A, Lu X, Caicedo JC, Cimini BA, Karhohs K, Logan DJ, Rohban MH, Kost-Alimova M, Hartland K, Bornholdt M, Chandrasekaran SN, Haghighi M, Weisbart E, Singh S, Subramanian A, Carpenter AE. (2022) Morphology and gene expression profiling provide complementary information for mapping cell state.	False	The main goal of the paper is to investigate how morphology and gene expression profiling provide complementary information for mapping cell state, rather than developing a new technology or method.
doi:10.1101/2022.10.23.512956	ScientificPrimaryResearchPreprint	Reisman E, Botella J, Huang C, Schittenhelm RB, Stroud DA, Granata C, Chandrasiri S, Ramm G, Oorschot V, Caruana NJ, Bishop DJ. (2022) Fibre-specific mitochondrial protein abundance is linked to resting and post-training mitochondrial content in human muscle	False	The main goal of the paper is to investigate mitochondrial differences in human skeletal muscle before and after training using mass spectrometry-based proteomics, rather than the development of new technology or methods.
doi:10.1038/s41467-022-33268-y	ScientificPrimaryResearchArticle	Calabrese B, Jones SL, Shiraishi-Yamaguchi Y, Lingelbach M, Manor U, Svitkina TM, Higgs HN, Shih AY, Halpain S. (2022) INF2-mediated actin filament reorganization confers intrinsic resilience to neuronal ischemic injury.	False	The paper is focused on investigating how biological systems work, specifically studying the role of actin filament reorganization in conferring resilience to neuronal ischemic injury.
doi:10.1101/2022.10.06.511160	ScientificPrimaryResearchPreprint	Negretti NM, Son Y, Crooke P, Plosa EJ, Benjamin JT, Jetter CS, Bunn C, Mignemi N, Marini J, Hackett AN, Ransom M, Nichols D, Guttentag SH, Pua HH, Blackwell TS, Zacharias W, Frank DB, Kozub JA, Mahadevan-Jansen A, Kropski JA, Wright CV, Millis B, Sucre JMS. (2022) Epithelial Outgrowth Through Mesenchymal Rings Drives Alveologenesis	False	The main goal of the paper is to understand how alveoli are formed and maintained during lung organogenesis and regeneration, rather than to develop new technology or methods.
doi:10.1083/jcb.202107134	ScientificPrimaryResearchArticle	Weier AK, Homrich M, Ebbinghaus S, Juda P, Miková E, Hauschild R, Zhang L, Quast T, Mass E, Schlitzer A, Kolanus W, Burgdorf S, Gruß OJ, Hons M, Wieser S, Kiermaier E. (2022) Multiple centrosomes enhance migration and immune cell effector functions of mature dendritic cells.	False	The main goal of the paper is to investigate how multiple centrosomes impact the migration and immune cell effector functions of mature dendritic cells, rather than developing new technology or methods.
doi:10.1016/j.jsb.2022.107899	ScientificPrimaryResearchArticle	Weerakoon AT, Condon N, Cox TR, Sexton C, Cooper C, Meyers IA, Thomson D, Ford PJ, Roy S, Symons AL. (2022) Dynamic dentin: A quantitative microscopic assessment of age and spatial changes to matrix architecture, peritubular dentin, and collagens types I and III.	False	The main goal of the paper is to investigate age and site-related changes in human dentin collagen, rather than to develop new technology or methods.
doi:10.1016/j.ebiom.2022.104296	ScientificPrimaryResearchArticle	Ackermann M, Kamp JC, Werlein C, Walsh CL, Stark H, Prade V, Surabattula R, Wagner WL, Disney C, Bodey AJ, Illig T, Leeming DJ, Karsdal MA, Tzankov A, Boor P, Kühnel MP, Länger FP, Verleden SE, Kvasnicka HM, Kreipe HH, Haverich A, Black SM, Walch A, Tafforeau P, Lee PD, Hoeper MM, Welte T, Seeliger B, David S, Schuppan D, Mentzer SJ, Jonigk DD. (2022) The fatal trajectory of pulmonary COVID-19 is driven by lobular ischemia and fibrotic remodelling.	False	The main goal of the paper is to provide comprehensive insights into the pathophysiology of severe COVID-19 and identify liquid biomarkers for disease severity and therapy response. The methods used are aimed at studying lungs and analyzing biomarkers rather than developing new technology or methods.
doi:10.3389/fcell.2022.974168	ScientificPrimaryResearchArticle	Taiber S, Gozlan O, Cohen R, Andrade LR, Gregory EF, Starr DA, Moran Y, Hipp R, Kelley MW, Manor U, Sprinzak D, Avraham KB. (2022) A Nesprin-4/kinesin-1 cargo model for nuclear positioning in cochlear outer hair cells.	False	The main goal of the paper is to investigate how biological systems work, specifically focusing on the mechanisms underlying nuclear positioning in cochlear outer hair cells rather than developing new technology or methods.
doi:10.1088/2050-6120/ac8d4c	ScientificReviewArticle	Otaiza-González S, Cabadas M, Robert G, Stock RP, Malacrida L, Lascano R, Bagatolli LA. (2022) The innards of the cell: studies of water dipolar relaxation using the ACDAN fluorescent probe.	False	The main goal of the paper is to investigate how biological systems work by using the ACDAN fluorescent probe to study water dipolar relaxation in cells, tissues, and biomimetic systems. The methods section describes the use of the ACDAN fluorophore in different environments to map water dipolar relaxation.
doi:10.15252/msb.202211087	ScientificPrimaryResearchArticle	Stallaert W, Taylor SR, Kedziora KM, Taylor CD, Sobon HK, Young CL, Limas JC, Varblow Holloway J, Johnson MS, Cook JG, Purvis JE. (2022) The molecular architecture of cell cycle arrest.	False	The goal of the paper is to investigate how biological systems work by studying the molecular architecture of cell cycle arrest, rather than developing new technology or methods.
doi:10.1093/nar/gkac003	ScientificPrimaryResearchArticle	Mei L, Kedziora KM, Song EA, Purvis JE, Cook JG. (2022) The consequences of differential origin licensing dynamics in distinct chromatin environments.	False	The main goal of the paper is to investigate how biological systems work, specifically focusing on the consequences of differential origin licensing dynamics in distinct chromatin environments.
doi:10.1016/j.celrep.2022.111358	ScientificPrimaryResearchArticle	Mondal C, Gacha-Garay MJ, Larkin KA, Adikes RC, Di Martino JS, Chien CC, Fraser M, Eni-Aganga I, Agullo-Pascual E, Cialowicz K, Ozbek U, Naba A, Gaitas A, Fu TM, Upadhyayula S, Betzig E, Matus DQ, Martin BL, Bravo-Cordero JJ. (2022) A proliferative to invasive switch is mediated by srGAP1 downregulation through the activation of TGF-β2 signaling.	False	The main goal of the paper is to investigate the role of srGAP1 in the proliferative-to-invasive switch in breast cancer cells, along with the underlying mechanisms involving TGF-β2 signaling. There is no indication that the paper focuses on developing new technology or methods.
doi:10.48550/arxiv.2208.13854	ScientificPrimaryResearchArticle	Djutanta, Franky et al. (2022) Microscopic motility of isolated E. coli flagella	False	The main goal of the paper is to investigate the microscopic motility of isolated E. coli flagella by studying their hydrodynamic propulsion matrix and efficiency, rather than developing new technology or methods.
doi:10.1101/2022.08.25.505332	ScientificPrimaryResearchPreprint	Okur MN, Kimura R, Sahbaz BD, Manor U, Patel J, Andrade L, Puligilla K, Croteau DL, Bohr VA. (2022) Long-term NAD+ supplementation prevents the progression of age-related hearing loss in mice	False	The main goal of the paper is to investigate the effects of long-term NAD+ supplementation on age-related hearing loss in mice, not to develop a new technology or method. The study aims to understand the biological mechanisms underlying the prevention of age-related hearing loss.
doi:10.15252/embj.2021110398	ScientificPrimaryResearchArticle	Rodgers SJ, Jones EI, Arumugam S, Hamila SA, Danne J, Gurung R, Eramo MJ, Nanayakkara R, Ramm G, McGrath MJ, Mitchell CA. (2022) Endosome maturation links PI3Kα signaling to lysosome repopulation during basal autophagy.	False	The main goal of the paper is to investigate how cells coordinate lysosome repopulation during basal autophagy, rather than developing new technology or methods.
doi:10.1038/s41467-022-32318-9	ScientificPrimaryResearchArticle	Bhadra AK, Rau MJ, Daw JA, Fitzpatrick JAJ, Weihl CC, True HL. (2022) Disease-associated mutations within the yeast DNAJB6 homolog Sis1 slow conformer-specific substrate processing and can be corrected by the modulation of nucleotide exchange factors.	False	The main goal of the paper is to investigate and understand the molecular basis of a disease-associated mutation within the chaperone network, rather than to develop new technology or methods.
doi:10.1161/circulationaha.121.057400	ScientificPrimaryResearchArticle	Kopecky BJ, Dun H, Amrute JM, Lin CY, Bredemeyer AL, Terada Y, Bayguinov PO, Koenig AL, Frye CC, Fitzpatrick JAJ, Kreisel D, Lavine KJ. (2022) Donor Macrophages Modulate Rejection After Heart Transplantation.	False	The main goal of the paper is to investigate how donor macrophages modulate rejection after heart transplantation, rather than developing new technology or methods. The focus is on understanding the biological processes involved in the immune response post-transplantation.
doi:10.1101/2022.07.20.22277868	ScientificPrimaryResearchPreprint	Murray SB, Cabeen RP, Jann K, Tadayonnejad R, Strober M, Feusner JD. (2022) White Matter Microstructure in Habit and Reward Circuits in Anorexia Nervosa: Insights from a Neurite Orientation Dispersion and Density Imaging Study	False	The main goal of the paper is to investigate how white matter microstructure in habit and reward circuits in anorexia nervosa differs from healthy controls using neurite orientation dispersion and density imaging methods. The study aims to understand the biological underpinnings of anorexia nervosa rather than developing new technology or methods.
doi:10.1016/j.isci.2022.104803	ScientificPrimaryResearchArticle	Ramirez MA, Ninoyu Y, Miller C, Andrade LR, Edassery S, Bomba-Warczak E, Ortega B, Manor U, Rutherford MA, Friedman RA, Savas JN. (2022) Cochlear ribbon synapse maturation requires Nlgn1 and Nlgn3.	False	The main goal of the paper is to investigate how Nlgn1 and Nlgn3 are required for cochlear ribbon synapse maturation and function, rather than developing new technology or methods.
doi:10.1126/scitranslmed.abn4819	ScientificPrimaryResearchArticle	Feng J, Zhao Y, Xie Z, Zang K, Sviben S, Hu X, Fitzpatrick JAJ, Wen L, Liu Y, Wang T, Lawson K, Liu Q, Yan Y, Dong X, Han L, Wu GF, Kim BS, Hu H. (2022) Miswiring of Merkel cell and pruriceptive C fiber drives the itch-scratch cycle.	False	The main goal of the paper is to investigate the peripheral mechanisms underlying the itch-scratch cycle, specifically focusing on the miswiring of Merkel cell and pruriceptive C fiber. The authors aimed to understand the pathophysiology of chronic itch rather than developing new technology or methods.
doi:10.1038/s41590-022-01257-4	ScientificPrimaryResearchArticle	Assen FP, Abe J, Hons M, Hauschild R, Shamipour S, Kaufmann WA, Costanzo T, Krens G, Brown M, Ludewig B, Hippenmeyer S, Heisenberg CP, Weninger W, Hannezo E, Luther SA, Stein JV, Sixt M. (2022) Multitier mechanics control stromal adaptations in the swelling lymph node.	False	The main goal of the paper is to investigate how biological systems work, specifically how different fibroblast populations mechanically control lymph node swelling in a multitier fashion.
doi:10.1016/j.clim.2022.109076	ScientificPrimaryResearchArticle	Pfeiffer SEM, Quesada-Masachs E, McArdle S, Zilberman S, Yesildag B, Mikulski Z, von Herrath M. (2022) Effect of IL4 and IL10 on a human in vitro type 1 diabetes model.	False	The main goal of the work is to investigate the effects of IL4 and IL10 on a human in vitro type 1 diabetes model, rather than developing new technology or methods. The paper aims to understand the biological responses in this model.
doi:10.1242/dev.199914	ScientificPrimaryResearchArticle	Romero-Morales AI, Robertson GL, Rastogi A, Rasmussen ML, Temuri H, McElroy GS, Chakrabarty RP, Hsu L, Almonacid PM, Millis BA, Chandel NS, Cartailler JP, Gama V. (2022) Human iPSC-derived cerebral organoids model features of Leigh syndrome and reveal abnormal corticogenesis.	False	The main goal of the paper is to investigate and characterize features of Leigh syndrome using human iPSC-derived cerebral organoids, rather than developing a new technology or method.
doi:10.1101/2022.06.29.498174	ScientificPrimaryResearchPreprint	Jann K, Boudreau J, Albrecht D, Cen SY, Cabeen RP, Ringman JM, Wang DJ, the Alzheimer’s Disease Neuroimaging Initiative. (2022) FMRI complexity correlates with tau-PET in Late-Onset and Autosomal Dominant Alzheimer’s Disease	False	The goal of the paper is to investigate how the complexity of BOLD signals relates to tau-related neuronal injury and cognitive decline in Alzheimer's disease. The methods involve data analysis, correlations, and path analysis to study the relationships between fMRI complexity, tau-PET measures, and cognitive function.
doi:10.1161/atvbaha.122.317111	ScientificPrimaryResearchArticle	Fletcher AJ, Nash J, Syed MBJ, Macaskill MG, Tavares AAS, Walker N, Salcudean H, Leipsic JA, Lim KHH, Madine J, Wallace W, Field M, Newby DE, Bouchareb R, Seidman MA, Akhtar R, Sellers SL. (2022) Microcalcification and Thoracic Aortopathy: A Window Into Disease Severity.	False	The main goal of the paper is to investigate the relationship between microcalcification and thoracic aortopathy, rather than developing new technology or methods.
doi:10.1101/2022.06.07.494932	ScientificPrimaryResearchPreprint	Choi ML, Chappard A, Singh BP, Maclachlan C, Rodrigues M, Fedotova E, Berezhnov AV, De S, Peddie C, Athauda D, Virdi GS, Zhang W, Evans JR, Wernick A, Zanjani ZS, Angelova PR, Esteras N, Vinikurov A, Morris K, Jeacock K, Tosatto L, Little D, Gissen P, Clarke DJ, Kunath T, Collinson L, Klenerman D, Abramov AY, Horrocks MH, Gandhi S. (2022) Structural conversion of α-synuclein at the mitochondria induces neuronal toxicity	False	The paper's goal is to investigate how α-Synuclein converts at the mitochondria and induces neuronal toxicity, rather than developing a new technology or method.
doi:10.1182/blood.2022015807	ScientificPrimaryResearchArticle	Ruben EA, Summers B, Rau MJ, Fitzpatrick JAJ, Di Cera E. (2022) Cryo-EM structure of the prothrombin-prothrombinase complex.	False	The main goal of the paper is to investigate how the prothrombinase complex functions in the coagulation cascade, rather than to develop new technology or methods. The authors aim to understand the molecular interactions involved in the activation of prothrombin to thrombin.
doi:10.3238/arztebl.m2022.0231	ScientificReviewArticle	Jonigk D, Werlein C, Lee PD, Kauczor HU, Länger F, Ackermann M. (2022) Pulmonary and Systemic Pathology in COVID-19—Holistic Pathological Analyses	False	The paper aims to provide background information, describe methods used for analysis, present results, and draw conclusions regarding the pathology of COVID-19. The main goal is to investigate and understand the pathological processes involved in COVID-19 rather than developing new technology or methods.
doi:10.1038/s41598-022-12705-4	ScientificPrimaryResearchArticle	White-Gilbertson S, Lu P, Esobi I, Echesabal-Chen J, Mulholland PJ, Gooz M, Ogretmen B, Stamatikos A, Voelkel-Johnson C. (2022) Polyploid giant cancer cells are dependent on cholesterol for progeny formation through amitotic division.	False	The main goal of the paper is to investigate how biological systems work, specifically focusing on the dependency of polyploid giant cancer cells on cholesterol for progeny formation through amitotic division.
doi:10.7554/elife.78793	ScientificPrimaryResearchArticle	Chrysostomou E, Flici H, Gornik SG, Salinas-Saavedra M, Gahan JM, McMahon ET, Thompson K, Hanley S, Kilcoyne M, Schnitzler CE, Gonzalez P, Baxevanis AD, Frank U. (2022) A cellular and molecular analysis of SoxB-driven neurogenesis in a cnidarian.	False	The main goal of the paper is to investigate the cellular and molecular mechanisms of neurogenesis in a cnidarian, using various techniques and analyses. The paper aims to provide insight into the evolution of neural function, rather than developing new technology or methods.
doi:10.3390/ijms23105773	ScientificPrimaryResearchArticle	Turner DL, Templin RM, Barugahare AA, Russ BE, Turner SJ, Ramm G, Mathias RA. (2022) UL34 Deletion Restricts Human Cytomegalovirus Capsid Formation and Maturation.	False	The main goal of the paper is to investigate the role of the UL34 protein in HCMV capsid formation and maturation, rather than developing new technology or methods.
doi:10.1101/2022.05.09.490051	ScientificPrimaryResearchPreprint	Prakash A, Paunikar S, Webber M, McDermott E, Vellanki SH, Thompson K, Dockery P, Jahns H, Brown JA, Hopkins AM, Bourke E. (2022) “Centrosome Amplification promotes cell invasion via cell-cell contact disruption and Rap-1 activation”	False	The main goal of the paper is to investigate how centrosome amplification promotes cell invasion and tumorigenesis in normal breast epithelial cells. The methods used in the study are aimed at understanding the mechanistic contributions of centrosome amplification to tumorigenesis rather than developing new technology or techniques.
doi:10.1371/journal.ppat.1010494	ScientificPrimaryResearchArticle	Bradley F, Franzén Boger M, Kaldhusdal V, Åhlberg A, Edfeldt G, Lajoie J, Bergström S, Omollo K, Damdimopoulos A, Czarnewski P, Månberg A, Oyugi J, Kimani J, Nilsson P, Fowke K, Tjernlund A, Broliden K. (2022) Multi-omics analysis of the cervical epithelial integrity of women using depot medroxyprogesterone acetate.	False	The main goal of the paper is to investigate how depot medroxyprogesterone acetate affects the cervical epithelial integrity of women, exploring molecular mechanisms and gene expression changes. The methods used include RNA-sequencing, quantitative imaging analysis, and protein level measurements.
doi:10.1016/j.ceca.2022.102595	ScientificReviewArticle	Bastian C, Sampieri A, Benavides MO, Guerrero A, Vaca L. (2022) Super-resolution microscopy for the study of store-operated calcium entry.	False	The main goal of the study is to investigate the relationship between cytoskeleton reorganization and store-operated calcium entry using super-resolution microscopy techniques, not to develop new technology or methods.
doi:10.1158/0008-5472.can-21-3155	ScientificPrimaryResearchArticle	Chakraborty P, Parikh RY, Choi S, Tran D, Gooz M, Hedley ZT, Kim DS, Pytel D, Kang I, Nadig SN, Beeson GC, Ball L, Mehrotra M, Wang H, Berto S, Palanisamy V, Li H, Chatterjee S, Rodriguez PC, Maldonado EN, Diehl JA, Gangaraju VK, Mehrotra S. (2022) Carbon Monoxide Activates PERK-Regulated Autophagy to Induce Immunometabolic Reprogramming and Boost Antitumor T-cell Function.	False	The main goal of the paper is to investigate how carbon monoxide activates PERK-regulated autophagy to induce immunometabolic reprogramming and boost antitumor T-cell function, rather than developing a new technology or method.
doi:10.1093/nar/gkac198	ScientificPrimaryResearchArticle	Budziszewski GR, Zhao Y, Spangler CJ, Kedziora KM, Williams MR, Azzam DN, Skrajna A, Koyama Y, Cesmat AP, Simmons HC, Arteaga EC, Strauss JD, Kireev D, McGinty RK. (2022) Multivalent DNA and nucleosome acidic patch interactions specify VRK1 mitotic localization and activity.	False	The main goal of the paper is to investigate how VRK1 interacts with DNA and nucleosomes to specify its mitotic localization and activity, rather than developing new technology or methods.
doi:10.1017/s0033291722000514	ScientificPrimaryResearchArticle	Murray SB, Alba C, Duval CJ, Nagata JM, Cabeen RP, Lee DJ, Toga AW, Siegel SJ, Jann K. (2022) Aberrant functional connectivity between reward and inhibitory control networks in pre-adolescent binge eating disorder.	False	The main goal of the paper is to investigate the aberrant functional connectivity between reward and inhibitory control networks in pre-adolescent binge eating disorder, rather than developing new technology or methods.
doi:10.3389/fmed.2022.849677	ScientificPrimaryResearchArticle	Mulenga C, Sviben S, Chandwe K, Amadi B, Kayamba V, Fitzpatrick JAJ, Mudenda V, Kelly P. (2022) Epithelial Abnormalities in the Small Intestine of Zambian Children With Stunting.	False	The goal of the paper is to investigate and understand epithelial abnormalities in Zambian children with stunting, rather than developing new technology or methods. The methods used include confocal laser endomicroscopy and histological analysis.
doi:10.1016/j.bpsgos.2022.03.004	ScientificPrimaryResearchArticle	Sibilia F, Custer RM, Irimia A, Sepehrband F, Toga AW, Cabeen RP, TRACK-TBI Investigators. (2022) Life After Mild Traumatic Brain Injury: Widespread Structural Brain Changes Associated With Psychological Distress Revealed With Multimodal Magnetic Resonance Imaging.	False	The main goal of the paper is to investigate the relationship between brain injury and psychological distress after mild TBI using multimodal magnetic resonance imaging. The methods involve using various imaging techniques to analyze brain structures and their association with psychological symptoms, rather than developing new technology or methods.
doi:10.1091/mbc.e21-10-0500	ScientificPrimaryResearchArticle	Julner A, Abbasi M, Menéndez-Benito V. (2022) The microtubule plus-end tracking protein Bik1 is required for chromosome congression.	False	The goal of the paper is to investigate how the microtubule plus-end tracking protein Bik1 is required for chromosome congression in yeast, not to develop new technology or methods.
doi:10.1101/2022.03.01.482451	ScientificPrimaryResearchPreprint	Dvornikov D, Halavatyi A, Khan MM, Zimmermann N, Cross A, Poeckel D, Melnikov E, Tischer C, Leyrer J, Schneider MA, Muley T, Winter H, Hessel E, Beinke S, Pepperkok R. (2022) Quantitative imaging reveals PI3Kδ inhibition reduces rhinovirus-induced damage of small airway epithelia in ex vivo cultured human precision cut lung slices from COPD patients	False	The main goal of the paper is to investigate how a PI3Kδ inhibitor affects rhinovirus-induced damage to small airway epithelia in COPD patients using quantitative imaging. The focus is on understanding the impact of the inhibitor on airway function and potential therapeutic opportunities.
doi:10.1158/2159-8290.cd-21-0522	ScientificPrimaryResearchArticle	Garciaz S, Guirguis AA, Müller S, Brown FC, Chan YC, Motazedian A, Rowe CL, Kuzich JA, Chan KL, Tran K, Smith L, MacPherson L, Liddicoat B, Lam EYN, Cañeque T, Burr ML, Litalien V, Pomilio G, Poplineau M, Duprez E, Dawson SJ, Ramm G, Cox AG, Brown KK, Huang DCS, Wei AH, McArthur K, Rodriguez R, Dawson MA. (2022) Pharmacologic Reduction of Mitochondrial Iron Triggers a Noncanonical BAX/BAK-Dependent Cell Death.	False	The main goal of the paper is to investigate how a drug-like small-molecule ironomycin reduces mitochondrial iron and triggers cell death in cancer cells, rather than developing new technology or methods.
doi:10.1016/j.psychres.2022.114473	ScientificPrimaryResearchArticle	Murray SB, Duval CJ, Balkchyan AA, Cabeen RP, Nagata JM, Toga AW, Siegel SJ, Jann K. (2022) Regional gray matter abnormalities in pre-adolescent binge eating disorder: A voxel-based morphometry study.	False	The paper aims to investigate regional gray matter abnormalities in pre-adolescent binge eating disorder using voxel-based morphometry. The goal is to understand the neurobiological markers of early-onset BED rather than developing new technology or methods.
doi:10.26508/lsa.202201378	ScientificPrimaryResearchArticle	Limas JC, Littlejohn AN, House AM, Kedziora KM, Mouery BL, Ma B, Fleifel D, Walens A, Aleman MM, Dominguez D, Cook JG. (2022) Quantitative profiling of adaptation to cyclin E overproduction.	False	The main goal of the paper is to investigate how cells adapt to cyclin E overproduction and to understand the mechanisms involved, rather than developing new technology or methods.
doi:10.1016/j.jcmg.2021.11.030	ScientificPrimaryResearchArticle	Kwiecinski J, Tzolos E, Fletcher AJ, Nash J, Meah MN, Cadet S, Adamson PD, Grodecki K, Joshi N, Williams MC, van Beek EJR, Lai C, Tavares AAS, MacAskill MG, Dey D, Baker AH, Leipsic J, Berman DS, Sellers SL, Newby DE, Dweck MR, Slomka PJ. (2022) Bypass Grafting and Native Coronary Artery Disease Activity.	False	The main goal of the paper is to investigate the influence of coronary artery bypass graft (CABG) surgery on native coronary artery disease activity and progression, rather than developing new technology or methods. The study aims to describe the potential of 18F-sodium fluoride (18F-NaF) positron emission tomography (PET) in identifying graft vasculopathy and its effects on native coronary arteries.
doi:10.1126/sciadv.abj4833	ScientificPrimaryResearchArticle	Vorontsova I, Vallmitjana A, Torrado B, Schilling TF, Hall JE, Gratton E, Malacrida L. (2022) In vivo macromolecular crowding is differentially modulated by aquaporin 0 in zebrafish lens: Insights from a nanoenvironment sensor and spectral imaging.	False	The main goal of the paper is to investigate how aquaporin 0 modulates macromolecular crowding in the zebrafish lens, using a nanoenvironment sensor and spectral imaging. The paper aims to understand the biological roles and regulation of macromolecular crowding rather than developing new technology or methods.
