doi	paper_type	citation	is_methods_paper	explanation
doi:10.1093/braincomms/fcac027	ScientificPrimaryResearchArticle	Patriat R, Pisharady PK, Amundsen-Huffmaster S, Linn-Evans M, Howell M, Chung JW, Petrucci MN, Videnovic A, Holker E, De Kam J, Tuite P, Lenglet C, Harel N, MacKinnon CD. (2022) White matter microstructure in Parkinson's disease with and without elevated rapid eye movement sleep muscle tone.	False	The main goal of the paper is to investigate how Parkinson's disease with and without elevated rapid eye movement sleep muscle tone affects white matter microstructure and its relationship to motor and cognitive function. The methods used include tract-based spatial statistics to compare diffusion MRI measures in different groups.
doi:10.1093/pcp/pcab167	ScientificPrimaryResearchArticle	Fisher KE, Krishnamoorthy P, Joens MS, Chory J, Fitzpatrick JAJ, Woodson JD. (2022) Singlet Oxygen Leads to Structural Changes to Chloroplasts during their Degradation in the Arabidopsis thaliana plastid ferrochelatase two Mutant.	False	The main goal of the work is to investigate the structural changes to chloroplasts during their degradation induced by singlet oxygen in the Arabidopsis thaliana plastid ferrochelatase two mutant. The methods used are described in the abstract, but the primary focus is on understanding the mechanisms of chloroplast degradation rather than developing new technology or methods.
doi:10.1016/j.celrep.2022.110296	ScientificPrimaryResearchArticle	Spillings BL, Day CJ, Garcia-Minambres A, Aggarwal A, Condon ND, Haselhorst T, Purcell DFJ, Turville SG, Stow JL, Jennings MP, Mak J. (2022) Host glycocalyx captures HIV proximal to the cell surface via oligomannose-GlcNAc glycan-glycan interactions to support viral entry.	False	The paper is focused on investigating how biological systems work, specifically on how HIV is captured near the cell surface via glycan-glycan interactions to support viral entry.
doi:10.1016/j.celrep.2022.110371	ScientificErrata	Anderson RH, Sochacki KA, Vuppula H, Scott BL, Bailey EM, Schultz MM, Kerkvliet JG, Taraska JW, Hoppe AD, Francis KR. (2022) Sterols lower energetic barriers of membrane bending and fission necessary for efficient clathrin-mediated endocytosis.	False	The goal of the paper is to investigate how biological systems work, specifically focusing on the role of sterols in membrane bending and fission during clathrin-mediated endocytosis.
doi:10.1016/j.yjsbx.2022.100060	ScientificPrimaryResearchArticle	Weerakoon AT, Cooper C, Meyers IA, Condon N, Sexton C, Thomson D, Ford PJ, Symons AL. (2022) Does dentine mineral change with anatomical location, microscopic site and patient age?	False	The main goal of the paper is to investigate how dentine mineral density, distribution, and composition are affected by patient age, anatomical location, and microscopic site, rather than developing new technology or methods.
doi:10.1126/science.abg3067	ScientificPrimaryResearchArticle	Orecchioni M, Kobiyama K, Winkels H, Ghosheh Y, McArdle S, Mikulski Z, Kiosses WB, Fan Z, Wen L, Jung Y, Roy P, Ali AJ, Miyamoto Y, Mangan M, Makings J, Wang Z, Denn A, Vallejo J, Owens M, Durant CP, Braumann S, Mader N, Li L, Matsunami H, Eckmann L, Latz E, Wang Z, Hazen SL, Ley K. (2022) Olfactory receptor 2 in vascular macrophages drives atherosclerosis by NLRP3-dependent IL-1 production.	False	The main goal of the paper is to investigate how olfactory receptor 2 in vascular macrophages drives atherosclerosis by NLRP3-dependent IL-1 production. The study aims to understand the biological mechanism underlying atherosclerosis rather than developing new technology or methods.
doi:10.1016/j.bpj.2022.01.008	ScientificPrimaryResearchArticle	Rohanifar M, Johnston BB, Davis AL, Guang Y, Nommensen K, Fitzpatrick JAJ, Pham CN, Setton LA. (2022) Hydraulic permeability and compressive properties of porcine and human synovium.	False	The paper's main goal is to characterize the material properties of synovium, such as compressive properties and hydraulic permeability, in order to better understand drug transport in joints. The methods used are experimental and computational approaches to measure these properties.
doi:10.1038/s42003-021-02953-x	ScientificPrimaryResearchArticle	Luke CJ, Markovina S, Good M, Wight IE, Thomas BJ, Linneman JM, Lanik WE, Koroleva O, Coffman MR, Miedel MT, Gong Q, Andress A, Campos Guerrero M, Wang S, Chen L, Beatty WL, Hausmann KN, White FV, Fitzpatrick JAJ, Orvedahl A, Pak SC, Silverman GA. (2022) Lysoptosis is an evolutionarily conserved cell death pathway moderated by intracellular serpins.	False	The main goal of the paper is to investigate and understand the lysoptosis cell death pathway moderated by intracellular serpins in an evolutionary context. The paper aims to show that lysoptosis is an evolutionarily conserved eukaryotic lysosome-dependent cell death pathway.
doi:10.1007/978-1-0716-2449-4_18	ScientificPrimaryResearchArticle	Afroz SF, Condon ND, Sweet MJ, Kapetanovic R. (2022) Quantifying Regulated Mitochondrial Fission in Macrophages.	False	The main goal of the paper is to investigate how regulated mitochondrial fission occurs in macrophages, rather than developing new technology or methods. The methods described are used to quantify mitochondrial dynamics in macrophages.
doi:10.1164/rccm.202103-0594im	ScientificPrimaryResearchArticle	Ackermann M, Tafforeau P, Wagner WL, Walsh CL, Werlein C, Kühnel MP, Länger FP, Disney C, Bodey AJ, Bellier A, Verleden SE, Lee PD, Mentzer SJ, Jonigk DD. (2022) The Bronchial Circulation in COVID-19 Pneumonia.	False	The paper is focused on investigating the bronchial circulation in COVID-19 pneumonia, which indicates a goal of understanding how biological systems work rather than developing new technology or methods.
doi:10.1126/sciadv.abg3693	ScientificPrimaryResearchArticle	Chassefeyre R, Chaiamarit T, Verhelle A, Novak SW, Andrade LR, Leitão ADG, Manor U, Encalada SE. (2021) Endosomal sorting drives the formation of axonal prion protein endoggresomes.	False	The main goal of the paper is to investigate the molecular mechanisms driving axonal misfolded PrP aggregate formation and their impact on neuronal viability, rather than developing new technology or methods.
doi:10.1007/s00125-021-05619-9	ScientificPrimaryResearchArticle	Quesada-Masachs E, Zilberman S, Rajendran S, Chu T, McArdle S, Kiosses WB, Lee JM, Yesildag B, Benkahla MA, Pawlowska A, Graef M, Pfeiffer S, Mikulski Z, von Herrath M. (2021) Upregulation of HLA class II in pancreatic beta cells from organ donors with type 1 diabetes.	False	The main goal of the paper is to investigate the expression of HLA class II in pancreatic beta cells from donors with type 1 diabetes and to analyze its induction in human islets. The methods used involve immunostaining, imaging techniques, and measuring islet function after treatment with proinflammatory cytokines. The focus is on understanding the biological phenomenon of HLA-II expression in pancreatic beta cells in the context of type 1 diabetes.
doi:10.1038/s41589-021-00935-y	ScientificPrimaryResearchArticle	Mendez DL, Lowder EP, Tillman DE, Sutherland MC, Collier AL, Rau MJ, Fitzpatrick JAJ, Kranz RG. (2021) Cryo-EM of CcsBA reveals the basis for cytochrome c biogenesis and heme transport.	False	The main goal of the paper is to investigate the structural basis for cytochrome c biogenesis and heme transport, not to develop new technology or methods.
doi:10.1016/j.devcel.2021.11.024	ScientificPrimaryResearchArticle	Gaertner F, Reis-Rodrigues P, de Vries I, Hons M, Aguilera J, Riedl M, Leithner A, Tasciyan S, Kopf A, Merrin J, Zheden V, Kaufmann WA, Hauschild R, Sixt M. (2021) WASp triggers mechanosensitive actin patches to facilitate immune cell migration in dense tissues.	False	The main goal of the paper is to investigate how biological systems work, specifically focusing on the role of WASp in facilitating immune cell migration in dense tissues.
doi:10.3390/cancers13235998	ScientificPrimaryResearchArticle	Leonard NA, Reidy E, Thompson K, McDermott E, Peerani E, Tomas Bort E, Balkwill FR, Loessner D, Ryan AE. (2021) Stromal Cells Promote Matrix Deposition, Remodelling and an Immunosuppressive Tumour Microenvironment in a 3D Model of Colon Cancer.	False	The main goal of the paper is to investigate the effects of stromal cells in a 3D model of colon cancer and to identify novel therapeutic targets, rather than developing a new technology or method.
doi:10.1016/j.cels.2021.10.007	ScientificPrimaryResearchArticle	Stallaert W, Kedziora KM, Taylor CD, Zikry TM, Ranek JS, Sobon HK, Taylor SR, Young CL, Cook JG, Purvis JE. (2021) The structure of the human cell cycle.	False	The main goal of the paper is to understand the organization of the human cell cycle, not to develop a new technology or method. The study utilizes time-lapse microscopy, single-cell imaging, and manifold learning to visualize the cell cycle and its molecular states.
doi:10.1016/j.redox.2021.102186	ScientificPrimaryResearchArticle	Zeb A, Choubey V, Gupta R, Kuum M, Safiulina D, Vaarmann A, Gogichaishvili N, Liiv M, Ilves I, Tämm K, Veksler V, Kaasik A. (2021) A novel role of KEAP1/PGAM5 complex: ROS sensor for inducing mitophagy.	False	The goal of the paper is to investigate how the KEAP1/PGAM5 complex functions as a ROS sensor to induce mitophagy. The methods used in the study involve demonstrating the role of KEAP1/PGAM5 complex in regulating mitophagy through experiments and inhibitors.
doi:10.1016/j.biopsych.2021.11.002	ScientificPrimaryResearchArticle	Zhao L, Matloff W, Shi Y, Cabeen RP, Toga AW. (2021) Mapping Complex Brain Torque Components and Their Genetic Architecture and Phenomic Associations in 24,112 Individuals.	False	The main goal of the paper is to investigate the genetic architecture, phenomic associations, and individual variations of structural brain torque components in a large sample of individuals, rather than developing new technology or methods.
doi:10.1002/art.41882	ScientificPrimaryResearchArticle	Shi Z, Garcia-Melchor E, Wu X, Getschman AE, Nguyen M, Rowland DJ, Wilson M, Sunzini F, Akbar M, Huynh M, Law T, Raychaudhuri SK, Raychaudhuri SP, Volkman BF, Millar NL, Hwang ST. (2021) Targeting the CCR6/CCL20 Axis in Entheseal and Cutaneous Inflammation.	False	The main goal of the paper is to investigate the involvement of the CCR6/CCL20 axis in psoriatic arthritis and psoriasis, as well as to evaluate its potential as a therapeutic target. The methods used in the study include quantifying CCL20 levels, examining CCR6+ cells, utilizing an IL-23 mouse model, and assessing the effect of CCL20 blockade.
doi:10.1016/j.celrep.2021.110008	ScientificPrimaryResearchArticle	Anderson RH, Sochacki KA, Vuppula H, Scott BL, Bailey EM, Schultz MM, Kerkvliet JG, Taraska JW, Hoppe AD, Francis KR. (2021) Sterols lower energetic barriers of membrane bending and fission necessary for efficient clathrin-mediated endocytosis.	False	The main goal of the paper is to investigate how sterols impact the energetic barriers of membrane bending and fission during clathrin-mediated endocytosis, rather than developing a new technology or method.
doi:10.7554/elife.67292	ScientificPrimaryResearchArticle	Gustafsson JK, Davis JE, Rappai T, McDonald KG, Kulkarni DH, Knoop KA, Hogan SP, Fitzpatrick JA, Lencer WI, Newberry RD. (2021) Intestinal goblet cells sample and deliver lumenal antigens by regulated endocytic uptake and transcytosis.	False	The main goal of the paper is to investigate and understand the cellular biology of goblet cell associated antigen passages (GAPs) and how goblet cells balance and regulate the processes of mucus secretion and antigen sampling. The methods used, such as high-resolution light and electron microscopy, were employed to study the biological processes rather than to develop new techniques or methods.
doi:10.1016/j.celrep.2021.109881	ScientificPrimaryResearchArticle	Errico JM, Zhao H, Chen RE, Liu Z, Case JB, Ma M, Schmitz AJ, Rau MJ, Fitzpatrick JAJ, Shi PY, Diamond MS, Whelan SPJ, Ellebedy AH, Fremont DH. (2021) Structural mechanism of SARS-CoV-2 neutralization by two murine antibodies targeting the RBD.	False	The main goal of the paper is to investigate how two murine antibodies neutralize SARS-CoV-2, rather than developing new technology or methods.
doi:10.1523/jneurosci.0378-21.2021	ScientificPrimaryResearchArticle	Vlasova RM, Iosif AM, Ryan AM, Funk LH, Murai T, Chen S, Lesh TA, Rowland DJ, Bennett J, Hogrefe CE, Maddock RJ, Gandal MJ, Geschwind DH, Schumann CM, Van de Water J, McAllister AK, Carter CS, Styner MA, Amaral DG, Bauman MD. (2021) Maternal Immune Activation during Pregnancy Alters Postnatal Brain Growth and Cognitive Development in Nonhuman Primate Offspring.	False	The main goal of the paper is to investigate the effects of maternal immune activation during pregnancy on postnatal brain growth and cognitive development in nonhuman primate offspring. The methods used in the study include evaluating neurodevelopment of male rhesus monkeys born to MIA-treated dams and conducting longitudinal MRI to assess brain development.
doi:10.1164/rccm.202011-4182im	ScientificPrimaryResearchArticle	Bing R, Andrews JPM, Williams MC, van Beek EJR, Lucatelli C, MacNaught G, Clark T, Koglin N, Stephens AW, MacAskill MG, Tavares AAS, Dhaliwal K, Dorward DA, Lucas CD, Dweck MR, Newby DE. (2021) <i>In Vivo</i> Thrombosis Imaging in Patients Recovering from COVID-19 and Pulmonary Embolism.	False	The main goal of the paper is to perform thrombosis imaging in patients recovering from COVID-19 and pulmonary embolism, which is more focused on understanding biological phenomena rather than developing new technology or methods.
doi:10.1002/ana.26200	ScientificPrimaryResearchArticle	Harding IH, Chopra S, Arrigoni F, Boesch S, Brunetti A, Cocozza S, Corben LA, Deistung A, Delatycki M, Diciotti S, Dogan I, Evangelisti S, França MC, Göricke SL, Georgiou-Karistianis N, Gramegna LL, Henry PG, Hernandez-Castillo CR, Hutter D, Jahanshad N, Joers JM, Lenglet C, Lodi R, Manners DN, Martinez ARM, Martinuzzi A, Marzi C, Mascalchi M, Nachbauer W, Pane C, Peruzzo D, Pisharady PK, Pontillo G, Reetz K, Rezende TJR, Romanzetti S, Saccà F, Scherfler C, Schulz JB, Stefani A, Testa C, Thomopoulos SI, Timmann D, Tirelli S, Tonon C, Vavla M, Egan GF, Thompson PM. (2021) Brain Structure and Degeneration Staging in Friedreich Ataxia: Magnetic Resonance Imaging Volumetrics from the ENIGMA-Ataxia Working Group.	False	The main goal of the paper is to investigate the brain structure and degeneration staging in Friedreich Ataxia using magnetic resonance imaging volumetrics. The focus is on understanding the spatial profile and progressive evolution of structural brain abnormalities in individuals with FRDA.
doi:10.1242/bio.058734	ScientificPrimaryResearchArticle	Lepanto P, Levin-Ferreyra F, Koziol U, Malacrida L, Badano JL. (2021) Insights into in vivo adipocyte differentiation through cell-specific labeling in zebrafish.	False	The goal of the work is to investigate how tissue and systemic factors influence the differentiation of new adipocytes in vivo in zebrafish, rather than to develop a new technology or method.
doi:10.1016/j.celrep.2021.109662	ScientificPrimaryResearchArticle	Lucas RM, Liu L, Curson JEB, Koh YWH, Tuladhar N, Condon ND, Das Gupta K, Burgener SS, Schroder K, Ingley E, Sweet MJ, Stow JL, Luo L. (2021) SCIMP is a spatiotemporal transmembrane scaffold for Erk1/2 to direct pro-inflammatory signaling in TLR-activated macrophages.	False	The main goal of the paper is to investigate how the immune-specific transmembrane adaptor SCIMP serves as a scaffold for Erk1/2 in TLR pathways and to understand its role in TLR-mediated pro-inflammatory responses in macrophages.
doi:10.1016/j.neuro.2021.08.011	ScientificPrimaryResearchArticle	Calsbeek JJ, González EA, Boosalis CA, Zolkowska D, Bruun DA, Rowland DJ, Saito NH, Harvey DJ, Chaudhari AJ, Rogawski MA, Garbow JR, Lein PJ. (2021) Strain differences in the extent of brain injury in mice after tetramethylenedisulfotetramine-induced status epilepticus.	False	The work aims to investigate the extent of brain injury in mice after TETS-induced status epilepticus in different mouse strains. The methods involve using in vivo imaging techniques to monitor brain injury and neuroinflammation.
doi:10.1038/s41467-021-25187-1	ScientificPrimaryResearchArticle	Quinn SE, Huang L, Kerkvliet JG, Swanson JA, Smith S, Hoppe AD, Anderson RB, Thiex NW, Scott BL. (2021) The structural dynamics of macropinosome formation and PI3-kinase-mediated sealing revealed by lattice light sheet microscopy.	False	The main goal of the paper is to investigate the structural dynamics of macropinosome formation and PI3-kinase-mediated sealing, not to develop new technology or methods.
doi:10.1016/j.cell.2021.07.017	ScientificPrimaryResearchArticle	Vergara HM, Pape C, Meechan KI, Zinchenko V, Genoud C, Wanner AA, Mutemi KN, Titze B, Templin RM, Bertucci PY, Simakov O, Dürichen W, Machado P, Savage EL, Schermelleh L, Schwab Y, Friedrich RW, Kreshuk A, Tischer C, Arendt D. (2021) Whole-body integration of gene expression and single-cell morphology.	False	The paper's goal is to explore the link between gene expression and morphology in animal bodies, not to develop new technology or methods. The methods used involve registering an expression atlas to an electron microscopy volume and automated segmentation of cells and nuclei.
doi:10.1073/pnas.2101391118	ScientificPrimaryResearchArticle	Niekamp S, Stuurman N, Zhang N, Vale RD. (2021) Three-color single-molecule imaging reveals conformational dynamics of dynein undergoing motility.	False	The paper's main goals are to investigate the conformational dynamics of dynein during motility and to model dynein stepping, rather than developing new technology or methods.
doi:10.1101/2021.07.16.452693	ScientificPrimaryResearchPreprint	Jin M, Shirazinejad C, Wang B, Yan A, Schöneberg J, Upadhyayula S, Xu K, Drubin DG. (2021) Rescue of stalled clathrin-mediated endocytosis by asymmetric Arp2/3-mediated actin assembly	False	The main goal of the paper is to investigate how actin assembly rescues stalled clathrin-mediated endocytosis sites, using various microscopy techniques and computational analysis. The focus is on understanding the biological process rather than developing a new method.
doi:10.1101/2021.07.12.451665	ScientificPrimaryResearchPreprint	Jo S, Cronin NM, Dewi Nurmalasari NP, Kerkvliet JG, Bailey EM, Anderson RB, Scott BL, Hoppe AD. (2021) IgG surface mobility promotes antibody dependent cellular phagocytosis by Syk and Arp2/3 mediated reorganization of Fcγ receptors in macrophages	False	The main goal of the paper is to investigate how IgG surface mobility promotes antibody-dependent cellular phagocytosis by studying the movements of Rituximab during ADCP, analyzing the reorganization of Fcγ receptors, and assessing the contributions of Syk and Arp2/3 in macrophages. The paper aims to understand the mechanisms underlying these processes rather than developing new technology or methods.
doi:10.1172/jci.insight.142945	ScientificPrimaryResearchArticle	Vang A, da Silva Gonçalves Bos D, Fernandez-Nicolas A, Zhang P, Morrison AR, Mancini TJ, Clements RT, Polina I, Cypress MW, Jhun BS, Hawrot E, Mende U, O-Uchi J, Choudhary G. (2021) α7 Nicotinic acetylcholine receptor mediates right ventricular fibrosis and diastolic dysfunction in pulmonary hypertension.	False	The goal of the paper is to investigate the role of α7 nicotinic acetylcholine receptor in right ventricular fibrosis and dysfunction in the context of pulmonary hypertension, as well as to explore potential therapeutic strategies. The methods used involve studying RV tissue from PH patients, an experimental rat model of PH, in vitro studies, and pharmacological antagonism of nAChR.
doi:10.1016/j.devcel.2021.05.015	ScientificPrimaryResearchArticle	Chou YY, Upadhyayula S, Houser J, He K, Skillern W, Scanavachi G, Dang S, Sanyal A, Ohashi KG, Di Caprio G, Kreutzberger AJB, Vadakkan TJ, Kirchhausen T. (2021) Inherited nuclear pore substructures template post-mitotic pore assembly.	False	The goal of the paper is to investigate how biological systems work, specifically focusing on the process of post-mitotic nuclear pore assembly. The methods described are used to support the findings and conclusions about the mechanisms involved in this biological process.
doi:10.3390/ijms22115948	ScientificPrimaryResearchArticle	Douek AM, Amiri Khabooshan M, Henry J, Stamatis SA, Kreuder F, Ramm G, Änkö ML, Wlodkowic D, Kaslin J. (2021) An Engineered <i>sgsh</i> Mutant Zebrafish Recapitulates Molecular and Behavioural Pathobiology of Sanfilippo Syndrome A/MPS IIIA.	False	The main goal of the paper is to investigate how biological systems work, specifically focusing on the pathobiology of Sanfilippo Syndrome A/MPS IIIA using a zebrafish model.
doi:10.3389/fpls.2021.616631	ScientificPrimaryResearchArticle	Kumar K, Gibbs HC, Yeh AT, Griffing LR. (2021) The Sterol Trafficking Pathway in <i>Arabidopsis thaliana</i>.	False	The main goal of the paper is to investigate the sterol trafficking pathway in Arabidopsis thaliana by studying the internalization mechanism of sterols in plant cells, which falls under understanding biological phenomena rather than developing new technology or methods.
doi:10.1038/s41467-021-23241-6	ScientificPrimaryResearchArticle	Rodgers SJ, Ooms LM, Oorschot VMJ, Schittenhelm RB, Nguyen EV, Hamila SA, Rynkiewicz N, Gurung R, Eramo MJ, Sriratana A, Fedele CG, Caramia F, Loi S, Kerr G, Abud HE, Ramm G, Papa A, Ellisdon AM, Daly RJ, McLean CA, Mitchell CA. (2021) INPP4B promotes PI3Kα-dependent late endosome formation and Wnt/β-catenin signaling in breast cancer.	False	The main goal of the paper is to investigate how biological systems work by exploring the role of INPP4B in promoting PI3Kα-dependent late endosome formation and Wnt/β-catenin signaling in breast cancer.
doi:10.7554/elife.62196	ScientificPrimaryResearchArticle	Okuda KS, Keyser MS, Gurevich DB, Sturtzel C, Mason EA, Paterson S, Chen H, Scott M, Condon ND, Martin P, Distel M, Hogan BM. (2021) Live-imaging of endothelial Erk activity reveals dynamic and sequential signalling events during regenerative angiogenesis.	False	The main goal of the paper is to investigate how endothelial Erk activity dynamically signals during regenerative angiogenesis, using a newly developed vascular Erk biosensor transgenic line in zebrafish. The study aims to understand the sequence of signalling events in this biological process rather than developing a new technology or method.
doi:10.1101/2021.05.15.442187	ScientificPrimaryResearchPreprint	Vorontsova I, Vallmitjana A, Torrado B, Schilling T, Hall JE, Gratton E, Malacrida L. (2021) <i>In vivo</i> macromolecular crowding is differentially modulated by Aquaporin 0 in zebrafish lens: insights from a nano-environment sensor and spectral imaging	False	The main goal of the paper is to investigate the roles of Aquaporin 0 in macromolecular crowding in the zebrafish lens, providing insights into lens development and vision. The methods used, such as the water nano-environmentally sensitive sensor and spectral imaging, are aimed at achieving the goal of understanding the biological system.
doi:10.1007/s11682-021-00467-y	ScientificPrimaryResearchArticle	Cabeen RP, Toga AW, Allman JM. (2021) Frontoinsular cortical microstructure is linked to life satisfaction in young adulthood.	False	The goal of the paper is to investigate the link between frontoinsular cortical microstructure and life satisfaction in young adults, using neuroimaging techniques. The paper aims to understand the biological basis of life satisfaction rather than developing a new technology or method.
doi:10.1038/s41467-021-22253-6	ScientificPrimaryResearchArticle	Horne CR, Venugopal H, Panjikar S, Wood DM, Henrickson A, Brookes E, North RA, Murphy JM, Friemann R, Griffin MDW, Ramm G, Demeler B, Dobson RCJ. (2021) Mechanism of NanR gene repression and allosteric induction of bacterial sialic acid metabolism.	False	The main goal of the paper is to investigate the mechanism of NanR gene repression and allosteric induction of bacterial sialic acid metabolism. The methods used in the study, such as cryo-electron microscopy and crystal structure analysis, were employed to understand the biological processes rather than to develop new technology or methods.
doi:10.1183/23120541.lsc-2021.33	ScientificPrimaryResearchArticle	M M Khan et al. (2021) Glucocorticoids exacerbate TGFß1 mediated fibrotic signalling in lung fibroblasts by inhibition of metalloproteinase expression and activity	False	The main goal of the paper is to investigate how glucocorticoids exacerbate TGFß1 mediated fibrotic signaling in lung fibroblasts, rather than developing new technology or methods. The study aims to understand the biological mechanisms underlying the observed effects.
doi:10.1016/j.cub.2021.02.028	ScientificPrimaryResearchArticle	Glanc M, Van Gelderen K, Hoermayer L, Tan S, Naramoto S, Zhang X, Domjan D, Včelařová L, Hauschild R, Johnson A, de Koning E, van Dop M, Rademacher E, Janson S, Wei X, Molnár G, Fendrych M, De Rybel B, Offringa R, Friml J. (2021) AGC kinases and MAB4/MEL proteins maintain PIN polarity by limiting lateral diffusion in plant cells.	False	The main goal of the paper is to investigate how AGC kinases and MAB4/MEL proteins regulate PIN polarity in plant cells, rather than developing new technology or methods.
